original,cleaned,subreddit,url
Reading Cafe / Reader' Club? [removed],read cafe / reader ' club ? remove,lucknow,https://www.reddit.com/r/lucknow/comments/1lzuq0r/reading_cafe_reader_club/
Productive weekend activities in LKO? [removed],productive weekend activity lko ? remove,lucknow,https://www.reddit.com/r/lucknow/comments/1lx50qm/productive_weekend_activities_in_lko/
"Everyone is something in LKO Born and raised in Delhi - I shifted to LKO in Dec 24 for business purposes. I have hardly seen a car which does not have a sticker on it - everyone is uttar pradesh sarkar, adhiwakta, nyay palika, mahamantri, skoda laura, adrak lsson. 


What is the obsession peeps. ","lko bear raise delhi - shift lko dec 24 business purpose . hardly see car sticker - uttar pradesh sarkar , adhiwakta , nyay palika , mahamantri , skoda laura , adrak lsson . 


 obsession peep .",lucknow,https://www.reddit.com/r/lucknow/comments/1lwyhny/everyone_is_something_in_lko/
